{
  "id": "tb-phoenix-mkds-1.5-2-5.08",
  "kind": "connector",
  "package": {
    "name": "TerminalBlock_Phoenix_MKDS-1,5-2-5.08_1x02_P5.08mm_Horizontal",
    "mount": "tht"
  },
  "kicad": {
    "symbol": "Connector:Screw_Terminal_01x02",
    "footprint": "TerminalBlock_Phoenix:TerminalBlock_Phoenix_MKDS-1,5-2-5.08_1x02_P5.08mm_Horizontal"
  },
  "pins": {
    "1": {
      "name": "Pin_1",
      "class": "passive"
    },
    "2": {
      "name": "Pin_2",
      "class": "passive"
    }
  },
  "evidence": [
    {
      "section": "pins",
      "method": "agent-prepared: pin numbers/names and pad multiset diffed against the installed KiCad 10.0.6 symbol and footprint files; no datasheet read",
      "verified_by": "agent-P1-T7",
      "date": "2026-10-27",
      "notes": "Scope: pad count, pad numbers and symbol pin numbers only. Pitch 5.08 mm is from the footprint name; no drawing compared."
    }
  ],
  "polarity": {
    "polarised": false,
    "pin1": "pin 1 = left-most screw when the wire entries face you",
    "pin1_footprint_marker": "roundrect pad 1"
  },
  "unverified_dims": [
    "pitch_mm",
    "drill_mm"
  ],
  "notes": "Reflex magnet outputs J2-J11 (up to 1.5 A each by design). Ratings NOT recorded (owner to add from the Phoenix MKDS 1,5 datasheet).",
  "status": "draft",
  "verification": "unverified",
  "signed_hash": null
}
