{
  "id": "hdr-2x10-p2.54-v",
  "kind": "connector",
  "package": {
    "name": "Pin header 2x10 2.54 mm vertical",
    "mount": "tht"
  },
  "kicad": {
    "symbol": "Connector_Generic:Conn_02x10_Odd_Even",
    "footprint": "Connector_PinHeader_2.54mm:PinHeader_2x10_P2.54mm_Vertical"
  },
  "pins": {
    "1": {
      "name": "Pin_1",
      "class": "passive"
    },
    "2": {
      "name": "Pin_2",
      "class": "passive"
    },
    "3": {
      "name": "Pin_3",
      "class": "passive"
    },
    "4": {
      "name": "Pin_4",
      "class": "passive"
    },
    "5": {
      "name": "Pin_5",
      "class": "passive"
    },
    "6": {
      "name": "Pin_6",
      "class": "passive"
    },
    "7": {
      "name": "Pin_7",
      "class": "passive"
    },
    "8": {
      "name": "Pin_8",
      "class": "passive"
    },
    "9": {
      "name": "Pin_9",
      "class": "passive"
    },
    "10": {
      "name": "Pin_10",
      "class": "passive"
    },
    "11": {
      "name": "Pin_11",
      "class": "passive"
    },
    "12": {
      "name": "Pin_12",
      "class": "passive"
    },
    "13": {
      "name": "Pin_13",
      "class": "passive"
    },
    "14": {
      "name": "Pin_14",
      "class": "passive"
    },
    "15": {
      "name": "Pin_15",
      "class": "passive"
    },
    "16": {
      "name": "Pin_16",
      "class": "passive"
    },
    "17": {
      "name": "Pin_17",
      "class": "passive"
    },
    "18": {
      "name": "Pin_18",
      "class": "passive"
    },
    "19": {
      "name": "Pin_19",
      "class": "passive"
    },
    "20": {
      "name": "Pin_20",
      "class": "passive"
    }
  },
  "evidence": [
    {
      "section": "pins",
      "method": "agent-prepared: pin numbers/names and pad multiset diffed against the installed KiCad 10.0.6 symbol and footprint files; no datasheet read",
      "verified_by": "agent-P1-T7",
      "date": "2026-10-27",
      "notes": "Scope: pad count, pad numbers and symbol pin numbers only. Pin numbering row-wise (Odd_Even) matches the footprint's pad order by number; physical positions not compared."
    }
  ],
  "tht": {
    "lead_mm": [
      0.64,
      0.64
    ]
  },
  "polarity": {
    "polarised": false,
    "pin1": "pin 1 = square pad; odd pins on one row, even pins on the other (row-wise numbering 1,2 / 3,4 ...)",
    "pin1_footprint_marker": "rect pad 1"
  },
  "unverified_dims": [
    "pin_square_mm"
  ],
  "notes": "Reflex J16 MEGA SPARE. Same 0.64 mm pin vs 1.0 mm drill margin note as hdr-2x04-p2.54-v.",
  "status": "draft",
  "verification": "unverified",
  "signed_hash": null
}
