{
  "id": "diode-do201ad-p5.08-v",
  "kind": "generic",
  "package": {
    "name": "D_DO-201AD_P5.08mm_Vertical_CathodeUp",
    "mount": "tht"
  },
  "kicad": {
    "symbol": "Device:D_Schottky",
    "footprint": "Diode_THT:D_DO-201AD_P5.08mm_Vertical_CathodeUp"
  },
  "tht": {
    "lead_d_mm": 1.3
  },
  "pins": {
    "1": {
      "name": "K",
      "class": "passive",
      "also": "cathode (band end, up)"
    },
    "2": {
      "name": "A",
      "class": "passive",
      "also": "anode (standing on the board)"
    }
  },
  "evidence": [
    {
      "section": "pins",
      "method": "agent-prepared: pin numbers/names and pad multiset diffed against the installed KiCad 10.0.6 symbol and footprint files; no datasheet read",
      "verified_by": "agent-P1-T7",
      "date": "2026-10-27",
      "notes": "Scope: pin numbers and pad multiset only. lead_d_mm 1.3 = typical DO-201AD lead (1.2-1.3, e.g. 1N5822); KiCad drill 1.6. Polarity: symbol Device:D_Schottky pin 1 = K, pin 2 = A; footprint pad 1 (roundrect) is the cathode, text 'K' on silk, 'CathodeUp' = body stands on the anode lead."
    }
  ],
  "polarity": {
    "polarised": true,
    "pin1": "cathode (K), band end",
    "pin1_footprint_marker": "roundrect pad 1 plus 'K' silk text"
  },
  "notes": "ILLUSTRATIVE: lead size is the family-typical value, not read from a part datasheet. POLARISED Schottky/flyback family, stood vertically (reflex D11-D20 1N5822). Pin 1 = cathode, pin 2 = anode; the vertical footprint hides the band, so mounting direction must follow the silk 'K'.",
  "status": "draft",
  "verification": "unverified",
  "signed_hash": null
}
